{
  "assumptions_zh": [
    "使用能在本案例 pH 区间产生可见变化的指示剂。",
    "滴定管、烧杯、搅拌方式和镜头固定。"
  ],
  "case_id": "CHEM-01",
  "discipline": "chemistry",
  "forbidden_shortcuts_zh": [
    "用漂亮画面掩盖机制条件缺失",
    "让图像模型重新决定程序事实",
    "让一个视频过渡跨越多个主要变化"
  ],
  "learning_goal_zh": "理解酸碱滴定中的颜色来自局部 pH、混合和终点阈值。",
  "schema_version": "1.0",
  "segments": [
    {
      "meaning_zh": "初始酸性溶液无持续终点颜色",
      "mechanism_condition_zh": "Phase 1 fixture_progress = 0.000000；Phase 2 必须替换为该案例的真实机制条件。",
      "only_major_change_zh": "初始酸性溶液无持续终点颜色",
      "order": 0,
      "segment_id": "segment_00"
    },
    {
      "meaning_zh": "一滴碱液造成落点附近的短暂局部颜色",
      "mechanism_condition_zh": "Phase 1 fixture_progress = 0.333333；Phase 2 必须替换为该案例的真实机制条件。",
      "only_major_change_zh": "一滴碱液造成落点附近的短暂局部颜色",
      "order": 1,
      "segment_id": "segment_01"
    },
    {
      "meaning_zh": "混合后局部颜色消失并继续接近终点",
      "mechanism_condition_zh": "Phase 1 fixture_progress = 0.666667；Phase 2 必须替换为该案例的真实机制条件。",
      "only_major_change_zh": "混合后局部颜色消失并继续接近终点",
      "order": 2,
      "segment_id": "segment_02"
    },
    {
      "meaning_zh": "最后一小滴混匀后浅色持续存在",
      "mechanism_condition_zh": "Phase 1 fixture_progress = 1.000000；Phase 2 必须替换为该案例的真实机制条件。",
      "only_major_change_zh": "最后一小滴混匀后浅色持续存在",
      "order": 3,
      "segment_id": "segment_03"
    }
  ],
  "title_zh": "酸碱滴定从局部变色到到达终点"
}
